{"run":1,"commit":"d4e5a00","metric":0,"metrics":{},"status":"discard","description":"Verification: all 108 tests pass after adding ProviderHealthCache + isHealthy to solveConstraints. No regression.","timestamp":1777262700864,"segment":0,"confidence":null,"iterationTokens":2661,"asi":{"hypothesis":"Adding health checks to the constraint solver with a new isHealthy callback and deduped docs won't break existing tests","test_count":108,"result":"all pass"}}
{"type":"config","name":"PolicyEngine integration infrastructure","metricName":"tests_passing","metricUnit":"","bestDirection":"higher"}
{"run":2,"commit":"d0d258c","metric":166,"metrics":{},"status":"keep","description":"Verification: PolicyEngine integration infrastructure — all 166 tests pass (146 existing + 20 new)","timestamp":1777327360286,"segment":1,"confidence":null,"iterationTokens":3734,"asi":{"hypothesis":"Adding PolicyEngine integration infrastructure (RoutingHints, StrategyRules, evaluateStrategy, buildStrategyRules, pipeline wiring, /auto-router rules command) won't break existing tests","test_count":166,"new_tests":20,"result":"all pass"}}
{"run":3,"commit":"3806572","metric":166,"metrics":{},"status":"keep","description":"PolicyEngine integration: example config updated with policyRules documentation","timestamp":1777327463846,"segment":1,"confidence":null,"iterationTokens":6892,"asi":{"hypothesis":"Adding policyRules documentation to example config won't affect tests","test_count":166,"result":"all pass"}}
{"run":4,"commit":"de7e844","metric":166,"metrics":{},"status":"keep","description":"PolicyEngine integration: README updated with /auto-router rules command","timestamp":1777327504745,"segment":1,"confidence":null,"iterationTokens":1661,"asi":{"hypothesis":"Documentation updates in README don't affect tests","test_count":166,"result":"all pass"}}
{"run":5,"commit":"1faf3cc","metric":171,"metrics":{},"status":"keep","description":"Route-scoped policy rules: StrategyRule.routeId scopes rules to their parent route, preventing cross-route interference","timestamp":1777327709325,"segment":1,"confidence":null,"iterationTokens":8849,"asi":{"hypothesis":"Rules must be scoped per route to prevent route A's rules from affecting route B","test_count":171,"new_tests":5,"result":"all pass","fix":"evaluateStrategy() now skips rules with non-matching routeId; buildStrategyRules accepts optional routeId; rebuildPolicyEngine passes per-route IDs"}}
{"run":6,"commit":"1faf3cc","metric":178,"metrics":{},"status":"keep","description":"Time-of-day conditions for PolicyRuleConfig: afterTime/beforeTime/daysOfWeek with overnight range support","timestamp":1777327877307,"segment":1,"confidence":null,"iterationTokens":6690,"asi":{"hypothesis":"Adding time-of-day conditions to PolicyRuleConfig enables time-based routing strategies","test_count":178,"new_tests":7,"result":"all pass","features":"afterTime, beforeTime (HH:MM), daysOfWeek (0-6), overnight range support (22:00-06:00), isTimeInRange() exported"}}
{"run":7,"commit":"1faf3cc","metric":189,"metrics":{},"status":"keep","description":"Circuit breaker: tracks per-provider failures, opens circuit at threshold, transitions to half-open on cooldown, wired into constraint solver and tryTarget loop","timestamp":1777328249645,"segment":1,"confidence":9.2,"iterationTokens":2568,"asi":{"hypothesis":"A circuit breaker prevents repeated attempts to failing providers","test_count":189,"new_tests":11,"result":"all pass","features":"CircuitBreaker with closed/open/half-open states, configurable threshold/window/cooldown, wired into isOnCooldown and tryTarget, reset on /auto-router reset"}}
{"run":8,"commit":"1faf3cc","metric":189,"metrics":{},"status":"keep","description":"Cost-aware ranking: estimated model cost used as secondary sort key within UVI buckets, surfaced in reasoning output","timestamp":1777328372043,"segment":1,"confidence":4.6,"iterationTokens":4906,"asi":{"hypothesis":"Sorting candidates by latency+estimated cost saves money without sacrificing speed","test_count":189,"result":"all pass","features":"lookupModelCost, estimateModelCost (4x output multiplier), cost tiebreaker in rankedSort and preferSort, est cost in reasoning output"}}
{"run":9,"commit":"1faf3cc","metric":198,"metrics":{},"status":"keep","description":"Balance fetcher retry: exponential backoff (500ms base, 2 retries) on HTTP failures + dedicated tests for retryWithBackoff and buildMonthlyQuotaWindow","timestamp":1777328534437,"segment":1,"confidence":3.764705882352941,"iterationTokens":7931,"asi":{"hypothesis":"Adding retry with exponential backoff to balance fetcher improves resilience against transient network errors","test_count":198,"new_tests":9,"result":"all pass","features":"retryWithBackoff with configurable maxRetries/baseDelayMs/maxDelayMs, applied to DeepSeek balance fetch, 5 retry tests + 4 buildMonthlyQuotaWindow tests"}}
{"run":10,"commit":"1faf3cc","metric":201,"metrics":{},"status":"keep","description":"Dry-run evaluation: /auto-router explain now shows per-rule match/fail trace and applied hints","timestamp":1777328781027,"segment":1,"confidence":2.9166666666666665,"iterationTokens":11299,"asi":{"hypothesis":"Showing strategy rule evaluation trace in /auto-router explain improves routing transparency","test_count":201,"new_tests":3,"result":"all pass","features":"PolicyEngine.getLastTrace() returns per-rule match/fail with reason; lastStrategyTraceByRoute stores trace for /auto-router explain; formatHintsHuman() for display"}}
{"run":11,"commit":"1faf3cc","metric":201,"metrics":{},"status":"keep","description":"Circuit breaker visibility: /auto-router circuit command + status line 🔌 circuit segment","timestamp":1777328895099,"segment":1,"confidence":2.1875,"iterationTokens":4709,"asi":{"hypothesis":"Adding circuit breaker visibility helps users understand why providers are being skipped","test_count":201,"result":"all pass","features":"formatCircuitStatusSegment in status line, /auto-router circuit shows per-provider state with icons"}}
{"run":12,"commit":"1faf3cc","metric":210,"metrics":{},"status":"keep","description":"Pipeline integration tests: 9 tests covering constraint-solver→budget-auditor→partitioner chain end-to-end","timestamp":1777329137449,"segment":1,"confidence":3.6666666666666665,"iterationTokens":1310,"asi":{"hypothesis":"Integration tests for the core pipeline chain catch regressions that unit tests miss","test_count":210,"new_tests":9,"result":"all pass","features":"9 test scenarios: empty pipeline, vision filter, budget audit, UVI promotion/demotion, hard mode, cooldown, critical UVI, full end-to-end chain"}}
{"run":13,"commit":"1faf3cc","metric":216,"metrics":{},"status":"keep","description":"Quota cache tests: 6 tests for mapRouteProviderToOAuth covering all provider mappings and edge cases","timestamp":1777329273256,"segment":1,"confidence":3.3333333333333335,"iterationTokens":10450,"asi":{"hypothesis":"Testing the provider-to-OAuth mapping function prevents routing bugs from misconfigured auth","test_count":216,"new_tests":6,"result":"all pass"}}
{"run":14,"commit":"1faf3cc","metric":222,"metrics":{},"status":"keep","description":"Enhanced intent classifier: more file extensions (.java/.c/.cpp/.h, .md/.rst/adoc), doc patterns, conversation depth boost","timestamp":1777329436286,"segment":1,"confidence":3.111111111111111,"iterationTokens":1313,"asi":{"hypothesis":"Better file extension and conversation depth awareness improves intent classification accuracy","test_count":222,"new_tests":6,"result":"all pass","features":"New code extensions (java/c/cpp/h), doc file patterns (md/rst/adoc), README/CHANGELOG patterns, conversation depth boost (+2 for 5+ msgs, +1 for 3+)"}}
{"run":15,"commit":"1faf3cc","metric":242,"metrics":{},"status":"keep","description":"Extracted pure display utilities into src/display.ts + 20 tests (parseModelSpec, describeTarget, formatHintsHuman, formatRemainingMs)","timestamp":1777329765031,"segment":1,"confidence":3.8974358974358974,"iterationTokens":13951,"asi":{"hypothesis":"Extracting pure utility functions from index.ts into a testable display module reduces index.ts size and enables unit testing","test_count":242,"new_tests":20,"result":"all pass","features":"parseModelSpec (7 tests), describeTarget (4 tests), formatHintsHuman (5 tests), formatRemainingMs (4 tests)"}}
{"run":16,"commit":"1faf3cc","metric":254,"metrics":{},"status":"keep","description":"Extracted cooldown helpers (parseResetAfterMs, getCooldownMs) to src/display.ts + 12 tests","timestamp":1777329929733,"segment":1,"confidence":4.4,"iterationTokens":7883,"asi":{"hypothesis":"Extracting cooldown logic enables testing of error-to-cooldown mapping","test_count":254,"new_tests":12,"result":"all pass","features":"parseResetAfterMs (6 tests: seconds/minutes/hours/abbreviated/edge cases), getCooldownMs (6 tests: rate limit/quota/not found/bad request/reset-after/default)"}}
{"run":17,"commit":"1faf3cc","metric":258,"metrics":{},"status":"keep","description":"Extracted normalizeModelToken to src/display.ts + 4 tests","timestamp":1777330013814,"segment":1,"confidence":4.181818181818182,"iterationTokens":3020,"asi":{"hypothesis":"Extracting normalizeModelToken enables testing the fuzzy model token matching logic","test_count":258,"new_tests":4,"result":"all pass"}}
{"run":18,"commit":"d23d5d1","metric":274,"metrics":{},"status":"keep","description":"Audit fixes: route-scoped cooldowns, tier logging, Kimi removal. 274 tests pass. Cooldown keys now include routeId prefix so rate-limit cooldowns don't propagate across routes. Tier log field uses effectiveTierFinal instead of hardcoded 'swe'. Kimi 2.5 removed from reasoning (L4→removed, L5-L7 renumbered to L4-L6) and long-context routes due to 50% failure rate.","timestamp":1777568169496,"segment":1,"confidence":4.695652173913044,"asi":{"hypothesis":"Route-scoped cooldowns will prevent L1-level targets from being globally excluded when one route rate-limits them","routes_tested":"verified subscription-reasoning falls through L1→L2 with isolated cooldowns","remaining_issue":"Claude Opus 4.7 is rate-limited (hit your limit) and will remain unavailable until reset. Gemini 3.1 Pro broken (Antigravity deprecated)."}}
{"run":19,"commit":"9883ace","metric":275,"metrics":{},"status":"keep","description":"Circuit breaker in getHealthyTargets + quota exhaustion cooldown. 275 tests (+1). getHealthyTargets now filters by circuitBreaker.isOpen() to prevent open-circuit providers from being used as constraint-solver fallbacks. 'hit your limit', 'credits exhausted', 'insufficient balance' now trigger 30min cooldown instead of falling to 90s default.","timestamp":1777568449414,"segment":1,"confidence":4.113207547169812,"asi":{"hypothesis":"Checking circuit breaker in getHealthyTargets prevents open-circuit providers from leaking through fallback paths, and longer cooldowns for quota exhaustion stop fruitless retries","new_tests":1,"total_tests":275,"coverage":"quota exhaustion messages now correctly identified"}}
{"run":20,"commit":"7490bec","metric":285,"metrics":{},"status":"keep","description":"Extracted formatModelLine to display.ts + 10 tests (285 total, +10). Pure function extraction with ModelDisplayInfo type export. Tests cover (current) marker, reasoning/vision capability labels, cost formatting, context window, and edge cases.","timestamp":1777568658538,"segment":1,"confidence":3.966666666666667,"asi":{"hypothesis":"Extracting formatModelLine as a pure function enables unit testing of the model formatting logic","new_tests":10,"total_tests":285,"lines_removed_from_index_ts":8}}
{"run":21,"commit":"43b6a00","metric":293,"metrics":{},"status":"keep","description":"Extracted tierToRequirements to constraint-solver.ts + 8 tests (293 total, +8). Pure function maps Tier to ConstraintRequirements: vision→vision, reasoning/swe→reasoning, long→minContextWindow, economy→empty. Removed 8 lines from index.ts.","timestamp":1777569010365,"segment":1,"confidence":3.5774647887323945,"asi":{"hypothesis":"Extracting tierToRequirements enables testing the tier-to-constraint mapping logic in isolation","new_tests":8,"total_tests":293,"index_ts_lines_removed":8}}
{"run":22,"commit":"09a2e84","metric":313,"metrics":{"new_tests":20,"total_tests":313},"status":"keep","description":"Health-check module tests: 20 tests covering ROUTE_TO_OAUTH mappings, resolveOAuth provider/authProvider precedence, TTL constants, ProviderHealthCache isHealthy/getHealthError/clear/checkAllIfStale. Exported resolveOAuth, ROUTE_TO_OAUTH, and TTL constants for testability.","timestamp":1777569150606,"segment":1,"confidence":3.769230769230769,"asi":{"hypothesis":"Adding tests for the health-check module catches OAuth mapping errors and ensures TTL-based health expiration works correctly","new_tests":20,"total_tests":313,"module":"health-check.ts","exports_added":4}}
{"run":23,"commit":"30f44e3","metric":320,"metrics":{"new_tests":7,"total_tests":320},"status":"keep","description":"Clock reset parsing: parseClockResetMs extracts 'resets 8pm (America/Los_Angeles)' patterns and computes ms until next occurrence. Wired into getCooldownMs for accurate cooldowns. 7 tests: 8pm, 11:30am, 12am, 12pm, non-clock, invalid hours.","timestamp":1777569317672,"segment":1,"confidence":3.710843373493976,"asi":{"hypothesis":"Parsing clock-time reset messages yields more accurate cooldowns than the 30min quota exhaustion heuristic, preventing fruitless retries","new_tests":7,"total_tests":320,"idea_source":"autoresearch.ideas.md parse resets Xpm"}}
{"run":24,"commit":"04bc170","metric":327,"metrics":{"new_tests":7,"total_tests":327},"status":"keep","description":"Extracted findCaseInsensitiveKey to display.ts + 7 tests. Generic case-insensitive key lookup replaces inline Object.keys().find() in resolveAlias. Tests: exact/case-insensitive match, original casing, no match, empty/undefined needle, empty record.","timestamp":1777569469943,"segment":1,"confidence":3.8333333333333335,"asi":{"hypothesis":"Extracting case-insensitive key lookup enables testing the alias matching logic in isolation","new_tests":7,"total_tests":327,"index_ts_line_saved":1}}
{"run":25,"commit":"a6f1576","metric":337,"metrics":{"new_tests":10,"total_tests":337},"status":"keep","description":"Unit tests for auditUsd and applyUtilization (+10). Exported both functions from budget-auditor. Tests: monthly vs daily limits, 80% boundary, projected-block, zero limit, missing spend, UVI passthrough, critical/stressed/surplus handling.","timestamp":1777569693947,"segment":1,"confidence":3.842696629213483,"asi":{"hypothesis":"Direct testing of auditUsd and applyUtilization catches edge cases that holistic auditBudget tests miss","new_tests":10,"total_tests":337,"functions_exported":2}}
{"run":26,"commit":"f9bbeca","metric":338,"metrics":{"new_tests":1,"total_tests":338},"status":"keep","description":"Throttled detection: added 'throttled' to rate-limit cooldown bucket in getCooldownMs. 1 new test + 2 assertions.","timestamp":1777569981400,"segment":1,"confidence":3.372549019607843,"asi":{"hypothesis":"Providers return 'Request throttled' or 'Throttled' for rate limits that should trigger 2m cooldown instead of 90s default","new_tests":1,"total_tests":338}}
{"run":27,"commit":"7e2be90","metric":348,"metrics":{"new_tests":10,"total_tests":348},"status":"keep","description":"Type guard tests: isValidEntry (decision-logger) + isValidRating (feedback-tracker). 10 tests covering null/array rejection, missing fields, invalid values, and valid cases.","timestamp":1777570151854,"segment":1,"confidence":3.7916666666666665,"asi":{"hypothesis":"Direct testing of type guards catches validation bugs that could silently accept corrupt persisted JSON entries","new_tests":10,"total_tests":348,"functions_exported":2}}
{"run":28,"commit":"2cdfa16","metric":354,"metrics":{"new_tests":6,"total_tests":354},"status":"keep","description":"Extracted getPrimaryModelLimits to display.ts with model resolution as callback. 6 tests: explicit limits, target lookup, claude-agent-sdk remapping, empty targets, undefined/throwing resolver. -10 lines from index.ts.","timestamp":1777570381476,"segment":1,"confidence":3.547169811320755,"asi":{"hypothesis":"Extracting getPrimaryModelLimits with a callback parameter decouples the pure logic from the pi SDK, enabling direct testing of the full resolution chain","new_tests":6,"total_tests":354,"index_ts_saved":10}}
{"run":29,"commit":"3b62ac6","metric":363,"metrics":{"new_tests":9,"total_tests":363},"status":"keep","description":"Extracted findModelInRegistry: three-pass (exact/normalized/partial) model matching logic from resolveModelFromRegistry. 9 tests: provider+id, slash-tail, normalized, partial, case-insensitive, cross-provider fallback, nonexistent, empty list, empty modelId. -32 lines from index.ts.","timestamp":1777570578412,"segment":1,"confidence":3.3389830508474576,"asi":{"hypothesis":"Extracting the registry-list scanning logic enables testing the three-pass model matching (exact, normalized, partial) in isolation","new_tests":9,"total_tests":363,"index_ts_saved":32}}
{"run":30,"commit":"b502090","metric":372,"metrics":{"new_tests":9,"total_tests":372},"status":"keep","description":"Extracted validateRouteTarget type guard to display.ts + 9 tests. Validates provider/modelId/label are non-empty, billing is subscription|per-token, authProvider/balanceEndpoint are correct types. -12 lines from index.ts.","timestamp":1777570765662,"segment":1,"confidence":3.169230769230769,"asi":{"hypothesis":"Extracting the RouteTarget type guard enables testing config validation edge cases (whitespace strings, invalid billing, type mismatches)","new_tests":9,"total_tests":372,"index_ts_saved":12}}
{"run":31,"commit":"5ce8fea","metric":377,"metrics":{"new_tests":5,"total_tests":377},"status":"keep","description":"Extracted getTargetKey to display.ts + 5 tests. Formats provider/modelId keys, optionally route-scoped. Null/undefined fallback to 'unknown/unknown'. -5 lines from index.ts.","timestamp":1777570870773,"segment":1,"confidence":3.2213740458015265,"asi":{"hypothesis":"Extracting getTargetKey enables testing the key formatting used by cooldowns, circuit breakers, and health checks","new_tests":5,"total_tests":377,"index_ts_saved":5}}
{"run":32,"commit":"c2324f9","metric":383,"metrics":{"new_tests":6,"total_tests":383},"status":"keep","description":"Latency type guard tests: isValidRecord (+6). Rejects null, non-objects, missing fields, negative values. Accepts zero values and valid records.","timestamp":1777570970096,"segment":1,"confidence":3.1449275362318843,"asi":{"hypothesis":"Testing the latency record type guard prevents corrupt persistence data from silently loading","new_tests":6,"total_tests":383}}
{"run":33,"commit":"16b80ab","metric":384,"metrics":{"new_tests":1,"total_tests":384},"status":"keep","description":"Added 500/502/504 to 5-minute cooldown bucket. Transient server errors now get proper 5-minute cooldown instead of 90s default. +1 test.","timestamp":1777571117986,"segment":1,"confidence":3.1366906474820144,"asi":{"hypothesis":"502/504/500 errors are transient server failures; 5m cooldown is more appropriate than 90s default","new_tests":1,"total_tests":384}}
{"type":"config","name":"Routing robustness reset","metricName":"tests_passing","metricUnit":"","bestDirection":"higher"}
{"run":34,"commit":"16b80ab","metric":384,"metrics":{"suites":68,"pass":384,"fail":0,"duration_ms":740.429166},"status":"discard","description":"Baseline after reset: npm test passes with 384 tests.","timestamp":1778042956809,"segment":2,"confidence":null,"asi":{"hypothesis":"Establish a clean baseline before new routing robustness experiments","rollback_reason":"Baseline only; no improvement yet","next_action_hint":"Inspect high-value roadmap/ideas items and add coverage or robustness fixes that improve real behavior without benchmark overfitting","rules_file_missing":"autoresearch.md not found in repository root","test_command":"npm test"}}
